{
  "jawAnimation": {
    "enabled": true,
    "servoPartId": "1",
    "activeConfigId": "config-1",
    "configs": [
      {
        "id": "config-1",
        "name": "Default",
        "sensitivity": 4.6,
        "smoothing": 0.5,
        "volumeThreshold": 0.02,
        "attackTime": 50,
        "releaseTime": 140,
        "useBandpassFilter": true,
        "useAGC": true,
        "quantizationLevels": 13,
        "preset": "custom",
        "minAngle": 28,
        "maxAngle": 84,
        "audioLeadTimeMs": 500
      }
    ],
    "ledSync": {
      "enabled": false,
      "partId": null,
      "colorLow": [
        80,
        0,
        0
      ],
      "colorHigh": [
        255,
        120,
        0
      ],
      "sensitivity": 1,
      "smoothing": 0.5,
      "attackMs": 40,
      "releaseMs": 120,
      "speed": 1,
      "offsetMs": 0
    }
  },
  "headTracking": {
    "opencvEnabled": true,
    "enabled": true,
    "panServoId": "2",
    "webcamPartId": "7",
    "centerDeg": 123,
    "rangeDeg": 26,
    "invertPan": true,
    "smoothing": 0.5,
    "deadzone": 1,
    "motionThreshold": 23,
    "minContourArea": 3000,
    "maxContourArea": 100000,
    "backgroundLearningRate": 0.017,
    "noiseReductionKernelSize": 5,
    "blurSize": 5,
    "dilateSize": 9,
    "varThreshold": 25,
    "targetLockStrength": 2,
    "confirmFrames": 3,
    "detectInterval": 5,
    "detectionMode": "person"
  },
  "followOrders": {
    "enabled": false,
    "requireAddressByName": false,
    "addressAliases": [],
    "ackMode": "speak",
    "ackPhrases": [
      "As you command."
    ],
    "refusalPhrases": [],
    "minConfidence": 0.6,
    "cooldownMs": 2000,
    "defaultDurationMs": 1200,
    "maxDurationMs": 3000,
    "enablePoseMatching": true,
    "enableGestureMatching": true,
    "enablePartMatching": true,
    "commands": [],
    "partAliases": []
  },
  "aiMotion": {
    "enabled": false,
    "triggers": {
      "agentGesture": true,
      "guestCommand": true,
      "ambientDuringSpeech": true
    },
    "permissions": {
      "allowedRoles": [
        "head",
        "jaw",
        "eye",
        "arm",
        "light"
      ],
      "deniedPartIds": [],
      "kidSafeOnly": false,
      "cooldownMs": 3000,
      "maxPerConversation": 0,
      "minConfidence": 0.6,
      "requireAddressByName": false,
      "ambientMinAmplitude": 0.2,
      "ambientMaxAmplitude": 0.5
    }
  }
}